3210,Ceipal,50,200.0,Software Development,"Applicant Tracking System, Recruiting Software, Human resource management software, HRMS, Staffing, HCM, Workforce Management, Employee Onboarding, Vendor Management Software, AI for Recruitment",Privately Held,United States,Rochester,EST
3220,Celeros Flow Technology,130.8,934.0,Mechanical Or Industrial Engineering,,Privately Held,United States,Charlotte,EST
3230,CenterPoint Energy,7600,7800.0,Utilities,"Energy delivery, Natural Gas Distribution, Electric Transmission & Distribution, Home Services, Safety, Integrity, Accountability, Initiative, Respect, Electric Grid Reliability, Electric Grid Resiliency , Net Zero by 2035, Enabling growth for our customers and the communities we share.",Public Company,United States,Houston,EST
3240,Ceridian,900,4200.0,Computer Software,"Onboarding, Payroll, Performance Management, Time & Attendance, Benefits, Document Management, Workforce Management, Dashboards, Recruiting, Learning, Succession Planning, On-Demand Pay",Public Company,United States,Minneapolis,EST
3250,CertainTeed,3000,6000.0,Wholesale Building Materials,"Manufacturer, Building Materials, Roofing, Siding, Insulation, Drywall, Ceilings",Privately Held,United States,Malvern,EST
3260,Champion National Security,300,1000.0,Security and Investigations,"Armed Security Officers, Unarmed Security Officers, Professional Guards, GPS Tracking",Public Company,United States,Richardson,EST
3270,Chargebee,124.4,1110.0,Financial Services,"Recurring Billing, Subscription Management, Payment Gateway Integration, Invoicing, Automated transactional emails, Taxes, Accounting, Revenue Recognition, SaaS Metrics, Pricing Iteration",Privately Held,United States,San Francisco,EST
3280,Charlotte Pipe and Foundry Company,1000,2500.0,Wholesale Building Materials,"plumbing systems, commercial construction, residential construction, building industry",Privately Held,United States,Charlotte,EST
3290,Chart Energy And Chemicals,200,800.0,Mechanical Or Industrial Engineering,"Process Engineering, Pipe Stress Engineering, Pressure Vessel Engineering",Public Company,United States,The Woodlands,CST
3300,"Chart Industries, Inc.",1400,4600.0,Industrial Machinery Manufacturing,"Cryogenic Storage Systems, Engineering / Manufacturing, Liquefied Natural Gas Storage, Heat Exchangers, Industrial Gas Storage, Hydrogen Energy, Water & Wastewater Treatment, Laser Cutting, Aerospace Systems, Beverage Carbonation, Nitro Beverage Dosing",Public Company,United States,Ball Ground,EST
3310,Checkers & Rallys Drive-In Restaurants,850,5800.0,Restaurants,"Fries, Burgers, Fast Food, QSR",Privately Held,United States,Tampa,EST
3320,Chemtool Incorporated,400,1000.0,Chemical Manufacturing,"Global, Reliable Manufacturing, Technical Innovator, Sustainability",Public Company,United States,Rockton,EST
3330,"Cheney Brothers, Inc.",2500,3500.0,Food and Beverage Services,"Food & Beverage Service & Distribution, Hospitality, Foodservice",Privately Held,United States,Riviera Beach,EST
3340,Chesapeake Energy,9800,2200.0,Oil & Energy,"Oil, Natural Gas Liquids, Natural Gas, Exploration, Drilling, Shale, Oil",Public Company,United States,Oklahoma City,EST
3350,Chevron Phillips Chemical Company,13000,5000.0,Chemical Manufacturing,Chemical commodities,Privately Held,United States,Spring,EST
3360,Chicago Pneumatic,600,1500.0,Mechanical Or Industrial Engineering,"high-performance air tools, construction equipment, compressors, air line accessories, workshop equipment, Energy, Oil & Gas",Public Company,United States,Rock Hill,EST
3370,Chobani,1700,2300.0,Food and Beverage Services,,Privately Held,United States,New Berlin,EST
3380,Cigniti Technologies,300,2200.0,Information Technology & Services,"Software Testing, Quality Assurance, Quality Engineering, Advisory & Transformation, Security Testing, DevOps QA, Test Automation, Digital Transformation services, ERP Testing, Application Testing, RPA, Digital Assurance, Digital Engineering, 5G Assurance, Cloud Migration Assurance, Performance Engineering, Static Application Security Testing, Blockchain, Analytics, Machine learning",Public Company,United States,Irving,EST
3390,Circus Foodtown,50,200.0,Retail,,Privately Held,United States,Middletown,EST
3400,Civeo North America,500,2000.0,Hospitality,"Remote Workforce Accomodations, Construction, Engineering, Hospitality, Remote Site Catering, Work Site Rentals, Custom Built Facilities, Fleet Rentals, Facility Management, Modular Construction, Modular Building",Public Company,United States,Houston,EST
3410,Class C Solutions Group,200,500.0,"Transportation, Logistics, Supply Chain and Storage","Vendor Managed Inventory Services, MRO Distribution, Integrated eCommerce, Consumption Controls",Public Company,United States,Davidson,EST
3420,Clemenceau Medical Center,100,800.0,Hospitals and Health Care,"Healthcare, Medical Tourism",Privately Held,Lebanon,Beirut,EET
3430,Coastal Holding,200,1000.0,Construction,"Steel Fabrication, Injection Moulding, Steel Galvanizing, Stadium Seating, Engineering, Construction, Architectural Products, Finishing, Light Posts, High Mast, Road Crash Barriers, Slotted Channels",Privately Held,Qatar,Doha,AST
3440,Coca-Cola Beverages Florida,1200,4500.0,Food and Beverage Services,Beverages,Public Company,United States,Tampa,EST
3450,Coca-Cola Beverages Northeast,5000,6000.0,Food and Beverage Services,,Privately Held,United States,Bedford,EST
3460,Coca-Cola Southwest Beverages,3300,8000.0,Food and Beverage Services,,Public Company,United States,Dallas,EST
3470,Codes Group,150,500.0,Construction,,Public Company,Egypt,Cairo,EET
3480,"Coeur Mining, Inc.",500,1200.0,Mining,"Silver and Gold Mining, Precious Metals Mining",Public Company,United States,Chicago,EST
3490,College H.U.N.K.S. Hauling Junk and Moving,50,200.0,Consumer Services,"Junk Removal, Moving Company, Moving Labor, Donation Pickup & Delivery, Professional Packing, Carpet Removal, Furniture Removal, Appliance Removal, Hot Tub Removal, Office Cleanouts | Downsizing, Recycling, Franchise Opportunities, Our Mission: ""Move The World""",Privately Held,United States,Tampa,EST
3500,Comcast Business,14000,91000.0,Telecommunications,"Business Phone, Broadband Internet, Ethernet Data Service, Business TV",Public Company,United States,Philadelphia,EST
3510,Commercial Bank,3400,4500.0,Banking,"Personal Banking, Private Banking, Wholesale Banking",Public Company,Qatar,Doha,Asia/Qatar
3520,Commercial Metals Company,5800,8600.0,Construction,"Metals, Recycling, Fabrication, Distribution",Public Company,United States,Irving,EST
3530,Compass Group USA,19000,240000.0,Food & Beverages,"foodservice management, food, support services, business & industry, hospitality, sports & entertainment, healthcare, education, catering",Public Company,United States,Charlotte,EST
3540,CompleteOK,30,100.0,Hospitals and Health Care,,Privately Held,United States,Tulsa,EST
3550,Composites One,299.8,702.0,Transportation/Trucking/Railroad,"Closed-Molding, Reinforcements, Resins, Processing Supplies, Gel Coats, Catalysts, Core Materials, Composites",Privately Held,United States,Schaumburg,EST
3560,Connector Manufacturing Company,150,500.0,"Appliances, Electrical, and Electronics Manufacturing",,Public Company,Canada,Hamilton,EST
3570,"Consolidated Aerospace Manufacturing, a Stanley Black and Decker Company",400,1000.0,Aviation and Aerospace Component Manufacturing,,Public Company,United States,Brea,EST
3580,Consumers Energy,6100,8500.0,Utilities,"Electric, Natural Gas, Energy/Utilities, Safety, Reliability",Public Company,United States,Jackson,EST
3590,Contech Engineered Solutions,900,2200.0,Construction,"Bridges and Structures, Rehabilitation and Reline, Stormwater Management, Pipe, Erosion control, Retaining Walls",Privately Held,United States,West Chester,EST
3600,Continuum Global Solutions,400,6500.0,Outsourcing and Offshoring Consulting,"telecom, call center, contact center, voice, ivr",Privately Held,United States,Dallas,EST
3610,ContourGlobal,2200,2200.0,Renewable Energy Semiconductor Manufacturing,"Energy, Development, Construction, Operation",Privately Held,United States,New York,EST
3620,ConvergeOne,1000,3000.0,Telecommunications,,,United States,Eagan,EST
3630,Corelle Brands,2000,4000.0,Manufacturing,"Consumer Goods, Iconic Brands, Manufacturing, Consumer Products, Innovation, Housewares, Durable Goods",Privately Held,United States,Downers Grove,EST
3640,Corsair,1460,1800.0,Computer Hardware,"Gaming Systems, Consumer Electronics, Gaming Peripherals, Computer Hardware, PC Peripherals",Public Company,United States,Milpitas,EST
3650,Coty News,200,1000.0,Manufacturing,,Self Owned,United States,Thurmont,EST
3660,"Covercraft Industries, LLC",116.6,200.0,Automotive,"Custom Vehicle Covers, Exterior Vehicle Protection, Interior Vehicle Protection, Softgoods Manufacturing, Contract Sewing, Pet Travel Products, RV Covers and Accessories, Work Truck Products, Boat Covers, ATV Covers, Patio Furniture Covers, Seat Covers, Dash Covers, Floor Mats, Cargo Liners, Windshield Sunscreens",Privately Held,United States,Pauls Valley,EST
3670,Covetrus,4000,5600.0,Non-profit Organization Management,,Privately Held,United States,Portland,EST
3680,Crafton Hills College,4.7,200.0,Higher Education,,Educational Institution,United States,Yucaipa,EST
3690,Cray Inc.,400,800.0,IT Services and IT Consulting,"Supercomputing, High Performance Computing (HPC), Storage, Big Data, Graph Analytics, Hadoop, AI, Artificial Intelligence, Cloud Supercomputing, HPC Storage, Supercomputing as a Service",Public Company,United States,Houston,EST
3700,Crescent Electric Supply Company,1500,2200.0,Wholesale,"Electrical Construction Materials, Residential, Commercial and Industrial, Energy, DataComm, Project Quotations and Management, Power Distribution Equipment, LED Lighting",Privately Held,United States,East Dubuque,EST
3710,Crocs,2100,3800.0,Consumer Goods,,Public Company,United States,Broomfield,EST
3720,Crop Production Services,3200,10000.0,Retail,"Crop Protection Products, Adjuvants and surfactants, Fertilizer and Plant Nutritional Products, Dyna-Gro Seed",Public Company,United States,Loveland,EST
3730,Crown Equipment Corporation,3200,15000.0,Truck Transportation,"Forklifts, Lift Trucks, Material Handling, Supply Chain, Logistics, Manufacturing, Warehousing, Fleet Management",Privately Held,United States,New Bremen,EST
3740,"Crown Holdings, Inc.",11000,33000.0,Packaging and Containers Manufacturing,"Metal Packaging, Beverage Cans, Food Cans, Speciality Cans, Aerosol Cans, Metal Closures, transit packaging, promotional Packaging, Very sensitive product packaging, sustainable packaging",Public Company,United States,Yardley,EST
3750,Crown Lift Trucks,2300,1500.0,Truck Transportation,"Forklifts, Lift Trucks, Material Handling, Supply Chain, Manufacturing, Warehouse Products, Fleet Management, Racking & Shelving",Privately Held,United States,New Bremen,EST
3760,Crown Roofing & Waterproofing,100,300.0,Construction,"Roof Maintenance and Service, Concrete and Clay tile, new construction and Reroof, Low slope roofing system service and replacement, Quality and Pride in Every Owner supervised project.",Privately Held,United States,Sarasota,EST
3770,CyberArk,430,2000.0,Computer Software,"Privileged Account Security, Advanced Threat Protection, Insider Threat Protection, Privileged Identity Management, Privileged Session Management, SSH Key Management, Highly Sensitive Information Management, Information Security Software, DevOps Security, DevSecOps, Cloud Security, Identity Security, Privileged Access Management",Public Company,United States,Newton,EST
3780,Cycle Gear Inc.,200,500.0,Retail,"Retail, Specialty Retail, Motorcycles",Privately Held,United States,Benicia,EST
3790,"Cynosure, LLC.",150,500.0,Medical Equipment Manufacturing,,Privately Held,United States,Westford,EST
3800,Cypress Bay High School,-,200.0,Education Administration Programs,,,United States,Weston,EST
3810,Cypress Semiconductor Corporation,2400,5400.0,Semiconductor Manufacturing,,Public Company,United States,San Jose,EST
3820,Cytel,200,1400.0,Pharmaceutical Manufacturing,"Adaptive Clinical Trials, Clinical Research Services, Trial Design and Analysis Software, Statistical Programming, Strategic Consulting, DMC Support, Program and Portfolio Optimization, Clinical Data Management, CV Outcomes Studies, Regulatory Submissions, Real World Analytics, HEOR, Bayesian Clinical Trials, FSP, Project Based Services, Advanced Analytics ",Privately Held,United States,Waltham,EST
3830,"DH Pace Company, Inc.",1200,2900.0,Building Materials,"Industrial, High Speed, & Specialty Doors, Loading Dock Equipment, Entry Doors & Automatic Doors, Electronic Security & Gate Systems, Residential Garage Doors & Operators, Preventive Maintenance Programs, Inspection & Testing Services, Doors, Docks, Commercial Sectional, Coiling and Sliding Doors",Privately Held,United States,Olathe,EST
3840,DMG MORI USA,1500,4000.0,Machinery Manufacturing,"Machine tools, CNC machines, machining, metalworking",Public Company,United States,Hoffman Estates,EST
3850,DRS SSI,200,500.0,Defense and Space Manufacturing,,Public Company,United States,St.Louis,CST
3860,DRS Tactical Systems,200,500.0,Defense and Space Manufacturing,,Public Company,United States,Melbourne,EST
3870,DRiV Incorporated,6000,31000.0,Automotive,"Replacement parts, Aftermarket",Public Company,United States,Northville,EST
3880,DTE Energy,10100,12000.0,Utilities,"Gas Distribution and Storage, Continuous Improvement, Unconventional Gas, Nuclear Generation, Merchant Operations, Biomass Generation, Six Sigma Blackbelt, Fossil or Coal Generation, Power Generation, Energy Trading, Mid-Stream Gas, Electric Utilities, Gas Utilities",Public Company,United States,Detroit,EST
3890,"Daiichi Sankyo, Inc.",8000,15000.0,Pharmaceuticals,"Daiichi Sankyo, Inc. is a member of the Daiichi Sankyo group of companies and is focused on the development of oncology therapies and specialty medicines., Oncology, Specialty Medicine",Public Company,United States,Basking Ridge,EST
3900,Daikin Middle East and Africa,2000,6000.0,Mechanical Or Industrial Engineering,"Air Conditioning, Energy Efficiency, HVAC, Room Air Conditioners, Commercial Air Conditioning, Industrial Air Conditioning, Service, Chillers, vrv, variable refrigerant Volumes (VRF systems), Air Side Systems (AHU + FCU), Modular chiller plants, refrirgeration, controls, heating, retrofit, energy solutions",Privately Held,United Arab Emirates,Dubai,GST
3910,Daktronics,500,2300.0,Manufacturing,"Large Screen LED Video Systems, LED Message Displays, LED Digital Billboards, Scoreboards & Timing Systems, Out of Home Advertising, Digital Signage, Dynamic Message Signs, Architectural Lighting, Intelligent Transporation Systems, Mobile and Modular LED Systems",Public Company,United States,Brookings,EST
3920,Dar Al Shifa Hospital,400,2100.0,Hospital & Health Care,"Healthcare -, Anesthesia & Intensive care, Cardiology, Dermatology & Cosmetics, Ear, Nose & Throat (ENT), Obstetrics & Gynecology, Reproductive Medicine, Pediatrics, Plastic surgery, Urology & Male Reproduction, Ophthalmology, Pain Management",Privately Held,Kuwait,"Hawalli,",AST
3930,Data Analysis Incorporated,75,200.0,Financial Services,"professional services, international business, printing, equity research, software solutions, data analytics, consulting, healthcare solutions, financial services, global equity market research, broker/dealer, trading stocks, omnichannel communications, data-driven composition, printing and mailing services, healthcare member communications, AI, machine learning, digital investment business news, IT applications, IT research & development",Privately Held,United States,Los Angeles,PST
3940,Datalink,150,300.0,IT Services and IT Consulting,"Cloud and Data Center Transformation, Data Center Migration, Data Center Consolidation, IT Architecture, Workload and Platform Alignment, Assessments, Consulting Services, Managed Services, Support Services, Professional Services",Public Company,United States,Eden Prairie,EST
3950,Dawlance,700,2200.0,Manufacturing,,Privately Held,Pakistan,Karachi,PKT
3960,Dawn Foods Global,1300,3500.0,Food Production,"Bakery Ingredients/ Products/ Service, Bakery Product Distribution, Bakery Product Manufacturing, Supermarket / In-store Bakeries, Artisanal Bakeries, Foodservice, Bakery Manufacturers",Privately Held,United States,Jackson,EST
3970,Day & Zimmermann,2800,23000.0,Construction,"Construction, Engineering, Staffing, Security, Defense, Operations & Maintenance",Privately Held,United States,Philadelphia,EST
3980,Dealer,100,300.0,Software Development,"Automotive Digital Marketing, Inventory Solutions, Websites, CRM, Digital Advertising, Social Media, Account Management, Managed Services, Digital Retailing, SEO, SEM, Retargeting, Paid Search, Display Advertising, Managed Services, Digital Retailing, Review Generation, Reputation Management, Website Management, Digital Marketing",Privately Held,United States,Burlington,EST
3990,Dealertrack,1200,5000.0,Software Development,"Automotive, Technology, Lender Solutions, Dealer Solutions, F&I, Registration and Title, Titling, eContracting, Digital Contracting, Compliance, Remote Signing",Privately Held,United States,North Hills,EST
4000,Degreed,104.4,587.0,Computer Software,"Education, Credentials, Social Recruiting, EdTech, Education Technology",Privately Held,United States,Pleasanton,EST
4010,"Delek US Holdings, Inc.",9000,1300.0,Oil and Gas,"Petroleum Refining, Wholesale Gas Marketing & Supply, Pipeline, energy, retail, oil & gas, downstream energy, logistics, asphalt, midstream energy, crude oil, refining, petroleum, renewable fuels, convenience stores",Public Company,United States,Brentwood,EST
4020,Delicato Family Wines,1000,2000.0,Beverage Manufacturing,"Wine, Culture",Privately Held,United States,Manteca,PST
4030,Democrat and Chronicle,100,500.0,Advertising Services,"Digital Marketing Solutions, Integrated Marketing Solutions, Native Content Marketing, News & information delivery, Search Engine Optimization (SEO), Pay Per Click (PPC) Advertising, Live Chat, Video Creating/Marketing, Email Marketing, Consumer Analytics, Advertising, Branded Content, Social Media Marketing, Display Advertising, Digital Marketing",Public Company,United States,Rochester,EST
4040,Denbury Inc.,1000,2000.0,Oil and Gas,Carbon Dioxide Enhanced Oil Recovery,Public Company,United States,Plano,EST
4050,Denodo,170.9,824.0,Computer Software,"enterprise data services, enterprise data integration, data virtualization, web integration, web automation, unstructured data, virtual database, real-time data, cloud integration, big data integration, Data Warehouse, Agile BI, Logical Data Warehouse, data governance, self-service BI, data analytics, machine learning, artificial intelligence, Data Integration, Data Fabric, Data Governance, data mesh, data management",Privately Held,United States,Palo Alto,EST
4060,Dentons US LLP,1400,2200.0,,,Privately Held,United States,Washington D.C,EST
4070,Dentsply Sirona,3900,15000.0,Medical Equipment Manufacturing,"Preventive, Restorative, Orthodontics, Prosthetics, Endodontics, Implants, Healthcare, Imaging, Instruments, CAD/CAM",Public Company,United States,Charlotte,EST
4080,Devon Energy,5700,1400.0,Oil and Gas,"Oil, Natural Gas, Natural Gas Liquids, Energy, Exploration, Production, Data Science, Technology, Health & Safety, Geology, Geophysics, Engineering, Petroleum Engineering, Accounting, Finance, Geoscience, IT, Project Management, Reservoir Engineering, Analytics, Accounting, Intelligent Automation, Artificial Intelligence, Robotic Process Automation",Public Company,United States,Oklahoma City,EST
4090,Diriyah Gate Development Authority,500,800.0,Government Administration,"Heritage, History, Tourism, Education, Art, Development, Culture, Entertainment & Leisure, Retail, Hospitality",Government Agency,Saudi Arabia,Riyadh,AST
4100,Discount Tire,5200,26620.0,Automotive,"Automotive Tires, Automotive Wheels",Privately Held,United States,Scottsdale,EST
4110,Ditch Witch,900,1500.0,Machinery,"Directional Drills, Trenchers, Vacuum Excavation, HDD Tooling, Mini Skid Steers",Public Company,United States,Perry,EST
4120,Dolby Laboratories,1200,2000.0,Computers and Electronics Manufacturing,"Audio, Video, Entertainment, Internet, Broadcast, Cinema, PC, Software, Hardware, Mobile, Voice, 3D, Film",Public Company,United States,San Francisco,EST
4130,Dolphin Energy,1900,1000.0,Oil & Energy,,Privately Held,United Arab Emirates,Abu Dhabi,GST
4140,Donnelley Financial Solutions (DFIN),1000,2400.0,Financial Services,"SEC Regulation, Government Reporting, Risk & Compliance, Digital Software, SaaS, Cybersecurity, Technology, Fintech, Financial Solutions, IPO, M&A, Proxy, Global Filings, GDPR, ESG, Capital Markets, Investment Markets, E-Delivery, Blockchain, Data Management",Public Company,United States,Chicago,EST
4150,Dorman Products,1500,3100.0,Motor Vehicle Manufacturing,"Direct-replacement automotive and heavy duty parts, Re-engineered parts designed to eliminate original failure modes, Supply Chain, Distribution, Manufacturing",Public Company,United States,Colmar,EST
4160,Dover Corporation,6900,24000.0,Machinery Manufacturing,"Fluids, Engineered Systems, Refrigeration & Food Equipment",Public Company,United States,Downers Grove,EST
4170,Dr. Bach Hospital,200,800.0,Hospitals and Health Care,"Internal Medicine Dept.  , Gastroenterology & Tropical Medicine Dept.     ,  Cardiovascular Dept.         ,         Rheumatology , Rehabilitation & Physiotherapy Dept.,   Dental Dept.,    Pediatric Dept.,     Internal Medicine/ Endocrinology Dept.,        Pulmonology & Respiratory Unit ,    Hematology & Oncology Dept.,     Allergy & Immunology Dept.,        Otolaryngology & Head and Neck Surgery  Dept.,       Ophthalmology  Dept.,     Orthopedics Surgeon Dept.,      Paediatrics Cardiology Dept.,      Obstetrics and Gynaecology Dept.,          Neurosurgery Dept.,        Dermatology , Venereology's & Andrology Dept.,        Urology Dept.,        Vascular Surgeon Dept.,   Oncology Dept.,        Paediatrics & Laparoscopic Surgery Dept.,    General Surgery Dept.,        Department of Nutrition, Bariatric and Laparoscopic Surgery",Sole Proprietorship,Saudi Arabia,Jeddah,AST
4180,Dragon Oil,1200,1800.0,Oil and Gas,"oil and gas exploration, development and production, Energy, Petroleum, People, HSE, sustanability",Public Company,United Arab Emirates,Dubai,GST
4190,Drake University,400,1200.0,Higher Education,Higher education,Educational Institution,United States,Des Moines,EST
4200,Drive DeVilbiss Healthcare,500,1500.0,Medical Equipment Manufacturing,"Manufacturing and distribution of durable medical equipment., durable medical equpment, healthcare, medical equipment",Privately Held,United States,Port Washington,EST
4210,Drury Hotels,1200,1500.0,Hospitality,"Careers, Meetings, Events, Groups, Tours, Business Travel, Legacy, Hospitality, Customer Service, Family Owned, Hotel, Quality, Service, Profitability, Teamwork, Culture, Travel, Awards, Rewards, Loyalty, resort",Privately Held,United States,St Louis,EST
4220,Dubai Polo and Equestrian Club,50,100.0,Spectator Sports,,Public Company,United Arab Emirates,Wadi Al Safa 6,GST
4230,"Dunn Solutions, a KaarTech Company",100,400.0,IT Services and IT Consulting,"Business Analytics, Custom Application Development, Mobile Applications, Data Warehousing, Portals, E-Commerce",Privately Held,United States,Chicago,EST
4240,Duquesne Light Company,900,1400.0,Utilities,"Providing a safe, reliable and affordable supply of energy and tools to homes, businesses and communities. Duquesne Light puts more information in the hands of our customers, allowing them to make more informed decisions about their energy consumption.",Privately Held,United States,Pittsburgh,EST
4250,Dusit Thani Guam Resort,50,400.0,Hospitality,,Privately Held,United States,Tumon,EST
4260,Dynatrace,800,2800.0,Software Development,"APM, DevOps, Full Stack, SaaS, Artificial Intelligence, Enterprise Cloud, Observability",Public Company,United States,Waltham,EST
4270,E. & J. Gallo Winery,5000,6400.0,Wine & Spirits,,Privately Held,United States,Modesto,EST
4290,"EBSCO Industries, Inc.",500,2000.0,Information Services,"Publishing, Manufacturing, Real Estate, Media, Research",Privately Held,United States,Birmingham,EST
4300,EIS,700,1400.0,Wholesale,,Public Company,United States,Atlanta,EST
4310,EMC,29000,40000.0,IT Services and IT Consulting,,,United States,Hopkinton,EST
4320,EMD Electronics,2300,1200.0,Chemical Manufacturing,"Electronics, Technology & Science, Chemicals, Semiconductors, Liquid Crystals, OLEDs, Cosmetics, Pigments & Coatings, Specialty Gases, Material Handling, Safety, Metal Film Precursors, Ultra-Thin Dielectric Precursors, Formulated Cleans, Etching Products, Doping, Chemical Mechanical Planarization (CMP), Deposition, Planarization, R&D, Conductive Pastes , Semiconductor Packaging, Displays",Public Company,United States,Tempe,EST
4330,"EMD Serono, Inc.",1500,1600.0,Biotechnology,metabolic endocrinology,Privately Held,United States,Rockland,EST
4340,EMKE Group,2500,32000.0,Retail,,Privately Held,United Arab Emirates,Abu Dhabi,GST
4350,EMS Technologies,500,1500.0,Defense and Space Manufacturing,Wireless communication on the move,Public Company,United States,Norcross,EST
4360,ENOC,15000,5700.0,Oil & Energy,"Gas, Oil, Retail, Terminals, Jet Fuel, Exploration and Production, Supply Trading and Processing",Government Agency,United Arab Emirates,Dubai,GST
4370,EPAM Anywhere,2200,18000.0,IT Services and IT Consulting,"Software & Platform Engineering, Agility, Product Development, IoT, Next-Gen Architecture, Application & Cloud Management, Big Data & Analytics, Consulting Services, Digital Engagement, Mobility, Strategy & Experience",Public Company,United States,Newtown,EST
