6680,Johns Hopkins Intrastaff,200,500.0,Hospitals and Health Care,,Public Company,United States,Lutherville,EST
6690,Johns Hopkins Medicine,8300,41000.0,Hospitals and Health Care,Patient Care,Nonprofit,United States,Baltimore,EST
6700,Johnsonville,1400,2400.0,Food and Beverage Manufacturing,"""Family Owned Since 1945""",Privately Held,United States,Sheboygan Falls,EST
6710,Jordan Kuwait Bank,400,2000.0,Banking,,Public Company,Jordan,Amman,Asia/Amman
6720,Joyson Safety Systems,7500,50000.0,Motor Vehicle Manufacturing,,Privately Held,United States,Auburn Hills,EST
6730,Juffali Technical Equipment Company,100,300.0,Retail,"Power Tools, Hand Tools, Cleaning Equipment, Wheel Alignment, Generators, forklifts, Air Compressors, Vehicles Lifts, Automotive Equipments, Skid Loaders, Gardening Equipment",Public Company,Saudi Arabia,Jeddah,AST
6740,Julphar,900,4600.0,Pharmaceutical Manufacturing,"Pharmaceuticals, Generics, Manufacturing, Insulin, Biotechnology, Biopharmaceuticals, Diabetes, Consumer Care, Pain Management, OTC, Innovation, R&D, Research & Development, Healthcare, UAE, MEA, Middle East, Pharma, Pharmacological",Public Company,United Arab Emirates,Ras Al Khaimah,GST
6750,K-Electric,3300,10500.0,Oil & Energy,"Electricity Generation, Transmission and Distribution",Public Company,Pakistan,Karachi,PKT
6760,"KARL STORZ Endoscopy-America, Inc.",1500,3200.0,Medical Equipment Manufacturing,"Design, Engineering, Manufacturing, Sales & Support",Privately Held,United States,El Segundo,EST
6770,KARL STORZ United States,1100,2800.0,Medical Equipment Manufacturing,"Design, Engineering, Manufacturing, Sales & Support, Medical Devices",Privately Held,United States,El Segundo,EST
6780,KATERRA,3000,8000.0,Construction,"Innovation, Design, Logistics, Sourcing, Architecture, Supply Chain, Manufacturing, Technology, Construction, Engineering, Efficiency, Job-site Integration, Cross Laminated Timber, Interior Design, Renovation, Material Supply, Labor Management",Privately Held,United States,Menlo Park,EST
6790,KAUST (King Abdullah University of Science and Technology),1300,8000.0,Higher Education,"Higher Education, Research",Educational Institution,Saudi Arabia,Thuwal,AST
6800,KLX Energy Services,700,2200.0,Oil and Gas,"Wireline Services, Thru Tubing Services, Fishing Services, Surface Facilities and Equipment, Pressure Control Services, Downhole Technology and Tools, Engineered Products, Project Consulting, Research and Development",Public Company,United States,Houston,EST
6810,KPMG In Pakistan,600,2100.0,Accounting,,Partnership,Pakistan,Karachi,PKT
6820,KPMG Lower Gulf,1400,1800.0,Accounting,"Audit, Tax, Advisory, KPMG Business Academy",Privately Held,United Arab Emirates,Dubai,GST
6830,KRONOS INTERNATIONAL INC.,1000,5000.0,Chemical Manufacturing,,Privately Held,Germany,Leverkusen,CET
6840,Kellanova,700,2500.0,Food and Beverage Manufacturing,,Public Company,United States,Chicago,EST
6850,Kennametal,2200,9000.0,Machinery Manufacturing,"metalworking, aerospace tooling, Machining, Drilling, Mining, Construction, Ceramics, automotive tooling, carbide",Public Company,United States,Pittsburgh,EST
6860,Kerzner International,800,8000.0,Hospitality,"Hospitality, Leisure",Privately Held,United Arab Emirates,Dubai,GST
6870,Keyloop,700,1500.0,Software Development,,Privately Held,United Kingdom,Reading,GMT
6880,Keystone First,150,400.0,Hospitals and Health Care,"Medicaid Managed Care, Behavioral Health Care Services, Medicare Advantage SNP, Pharmacy Benefits Management, Specialty Pharmacy, Long Term Services and Supports",Privately Held,United States,Philadelphia,EST
6890,Keystone Foods,3000,11000.0,Food and Beverage Manufacturing,"Proteins Processing, Leadership in Food Safety and Quality, KEYSTAR CSR Program, Global Reach, Product Innovation",Public Company,United States,West Chester,EST
6900,Khidmah,300,1500.0,Facilities Services,"Integrated Facility Management, Maintenance Solutions, Landscaping Solutions, Cleaning Solutions, Hospitality Solutions, Pest Control, MEP Services, Concierge Services, Professional and Certified Lifeguard Services, First Aid and Lifeguard Training Consultancy and Management",Sole Proprietorship,United Arab Emirates,Abu Dhabi,GST
6910,Kleinfelder,900,2000.0,Civil Engineering,"Architecture & Design, Facility/Operations Compliance, Construction Engineering & Testing, Geotechnical/Geologic Engineering, Design Engineering, Environmental Sciences & Engineering, Bridge Engineering, Risk Management, Sustainability, Water/Wastewater Science & Engineering, Program Management, Construction Management, Process, Mechanical & Electrical Engineering, Oil & Gas, Wastewater Infrastructure, Water Resources, Stormwater, Transportation, Commercial & Industrial Facilities, Power",Privately Held,United States,San Diego,EST
6920,Kloeckner Metals - Americas,2900,2500.0,Mechanical Or Industrial Engineering,,Public Company,United States,Roswell,EST
6930,Knights of Columbus,4200,1750.0,Financial Services,"Disability Income Insurance, Whole Life, Term Life, Long Term Care insurance, Annuities, Charity",Nonprofit,United States,New Haven,EST
6940,Knights of Columbus Insurance,3000,7000.0,Insurance,"Life Insurance, Annuities, Disability Income, Long Term Care",Nonprofit,United States,New Haven,EST
6950,Komatsu North America,5300,5700.0,Machinery Manufacturing,"Contruction, Mining and Forestry Equipment, Material handling",Public Company,United States,Chicago,EST
6960,Kona Grill,300,2200.0,Restaurants,"Sushi, American Grill, Happy Hour, Reverse Happy Hour, Best of...",Public Company,United States,Scottsdale,EST
6970,"Konica Minolta Business Solutions U.S.A., Inc.",3000,7500.0,Software Development,"Multifunction Printers (MFP), Digital Press, Workflow Solutions, IT Services, Technology Optimization, Enterprise Content Management (ECM), Security and Compliance, Cloud Services, Mobility, Optimized Print Services (MPS), Printing, Print Production, Industrial Printing, Packaging, Business Solutions, Industry Solutions, Intelligent Information Management, Help Desk, Video Surveillance, Digital Transformation, Cloud",Public Company,United States,Ramsey,EST
6980,Kraton Corporation,1900,2000.0,Chemical Manufacturing,,Privately Held,United States,The Woodlands,EST
6990,"Kwik Trip, Inc.",7500,24000.0,Retail,"Convenience Retail/Wholesale, petroleum, distribution center, warehouse, dairy",Privately Held,United States,La Crosse,EST
7000,L.A. Care Health Plan,3200,1900.0,Hospitals and Health Care,"HMO, Health Information Technology, Healthcare Insurance, Community Health",Nonprofit,United States,Los Angeles,EST
7010,LG Electronics North America,13000,5000.0,Computers and Electronics Manufacturing,"Consumer Electronics, Home Appliances, Air Conditioning, Home Entertainment, Mobile Communications, Solar, Display Technology, and B2B Products",Public Company,United States,Englewood Cliffs,EST
7020,LINN Energy,1800,1200.0,Oil and Gas,,Public Company,United States,Houston,EST
7030,LIQUIDATION CHANNEL,100,200.0,Retail,,Privately Held,United States,Austin,EST
7040,LIVEKINDLY Collective,200,500.0,Food & Beverages,,Privately Held,United States,New York City,EST
7050,Lab Safety Supply,100,300.0,Retail Office Equipment,,Public Company,United States,Janesville,EST
7060,Laborers Local 731,148,1500.0,Construction,,Nonprofit,United States,Astoria,EST
7070,"Lakeside Foods, Inc.",600,1200.0,Food and Beverage Manufacturing,"Food Manufacturing, Private Brand Food, Canned Vegetables, Frozen Vegetables, Canned Corn, Canned Peas, Canned Green Beans, Frozen Corn, Frozen Peas, Frozen Green Beans, Canned Dry Beans, Frozen Vegetables with Sauce, Frozen Whipped Topping, Consumer Food",Privately Held,United States,Manitowoc,EST
7080,Lands' End,1500,5000.0,Retail Apparel and Fashion,"Retail, Direct Sales, Catalog, Digital, Apparel and Fashion",Public Company,United States,Dodgeville,EST
7100,Lands' End Business,500,2200.0,Retail Apparel and Fashion,"Uniform Programs, Logo Embroidery, Promotional Products, Workwear, Business Uniforms, Company Apparel, Monogramming, Employee Gifts, Client Gifts, Team Outfitting",Public Company,United States,Dodgeville,EST
7110,Langan Engineering & Environmental Services,700,1200.0,Civil Engineering,"Geotechnical, Site/Civil and Environmental Engineering, Transportation/Traffic Engineering, Surveying, 3D Laser Scanning, and BIM, Cultural Resources, Natural Resources Assessments/Permitting, Landscape Architecture + Planning, GIS/Data Management Services",Privately Held,United States,Parsippany,EST
7120,Lastar Inc.,70,250.0,Computers and Electronics Manufacturing,"Cables, Connectivity, Wireless, Innovation, Audio / Video, Computer, PC, Consumer Electronics, Data Communication",Public Company,United States,Daylon,EST
7130,Le Bonheur Children's Hospital,900,3100.0,Hospitals and Health Care,"Pediatrics, Cardiology, Neonatology, Critical Care Medicine, Nephrology, Neurology, Orthopedics, Urology, Pulmonology, Gastroenterology",Nonprofit,United States,Memphis,EST
7140,Leggett & Platt,4200,22000.0,Furniture and Home Furnishings Manufacturing,"Automotive, Adjustable Beds, Bedding, Home Furniture, Work Furniture, Aerospace, Machinery, Flooring Products, Wire, Foam, Hydraulic Cylinders",Public Company,United States,Carthage,EST
7150,"Legrand, North America",5000,13000.0,"Appliances, Electrical, and Electronics Manufacturing",,Public Company,United States,West Hartford,EST
7160,LensCrafters,2500,12000.0,Retail Apparel and Fashion,"eyewear, eye care, retail, glasses, optometrist, optician, marketing, finance, real estate, information technology, accounting, sales",Public Company,United States,Cincinnati,EST
7170,Leonardo DRS,2200,7100.0,Defense and Space Manufacturing,"Information Technology, Defense, Intelligence, Aviation, Security, Surveillance, Power, Cyber Security, Infrared, Engineering, Innovation, STEM, Naval Systems, Maritime Systems, Satellite Communications, Network Infrastructure",Public Company,United States,Arlington,EST
7180,Leprino Foods,3200,4000.0,Food and Beverage Manufacturing,"dairy ingredients, mozzarella, cream, lactose, whey protein concentrate, provolone, reduced-fat Monterey jack and cheddar, wheyproteinisolate",Privately Held,United States,Denver,EST
7190,"Levinson & Associates, Inc.",30,100.0,Insurance,"Insurance, Marketing, CI, DI and LTC, Accident policies, Annuity, Premium Finance, IMO for Life Insurance",Public Company,United States,Coral Springs,EST
7200,Lexington Medical Center,3800,8000.0,Hospital & Health Care,"Heart Center, Women's Services, Cancer Center, Orthopaedics, Birth Center, Family Medicine, Urgent Care, General Surgery, Alzheimer's Care, Occupational Health, Weight-Loss Surgery, Emergency Medicine, Urgent Care, Health and Wellness",Nonprofit,United States,West Columbia,EST
7210,Lexus KSA,1000,2000.0,Motor Vehicle Manufacturing,,Privately Held,Saudi Arabia,Riyadh,AST
7220,Libbey,750,6100.0,Consumer Services,"Glassware, Dinnerware, Flatware, Serveware, beverageware, Tableware",Privately Held,United States,Toledo,EST
7230,Liberty Coca-Cola Beverages,2000,4000.0,Manufacturing,"CPG, Beverages, Distribution, Innovation, Branding, Sales, Coca-Cola",Privately Held,United States,Philadelphia,EST
7240,Lidl US,22000,29000.0,Retail,"Private Label, Grocery, Retail, Bakery, Low Prices, High Quality",Privately Held,United States,Arlington,EST
7250,Lids,800,4200.0,Retail,"Multi-Channel Retailer, All-Inclusive Team Sports Distributor, Custom Embroidery/Screen Printing, Branding Solutions",Privately Held,United States,Indianapolis,EST
7260,Life Technologies,3500,10000.0,Biotechnology Research,"Invitrogen, Applied Biosystems, Biotechnology tools and solutions, Sequencing, Reagents, Assays and kits, Benchtop, PCR instruments and consumables, Cloning and gene synthesis, Genome editing, Exosomes, Transfection, Protein expression and analysis, Cell media",Public Company,United States,Waltham,EST
7270,Lincoln Electric,3500,11000.0,Machinery Manufacturing,"Welding Consumables, Plasma Cutting Equipment, Welding Education, Technical Training & Seminars, Robotic Welding Automation, Weld Fume Control Solutions, Welding Safety Apparel, Welding Equipment, Welding Information Systems",Public Company,United States,Cleveland,EST
7280,Lindsay Corporation,1000,1200.0,Machinery Manufacturing,"Agricultural Irrigation, Railroad Structures and Signals, Water Management, Irrigation Technology, Road Infrastructure, Industrial Technology",Public Company,United States,Omaha,EST
7290,Lionbridge,750,6000.0,Translation and Localization,"Translation, Localization, Global Marketing, Product Engineering Services, Technical Writing, eLearning Services, Interpretation, Global Testing",Privately Held,United States,Waltham,EST
7300,Lionbridge Technologies,750,6000.0,Translation and Localization,"Traduccin, Localizacin, Global Marketing, eLearning",Privately Held,United States,Waltham,EST
7310,Lionsgate,4000,900.0,Entertainment,"Film & Television Production and Distribution, Entertainment, Movies, TV, Home Entertainment, Channels",Public Company,United States,Santa Monica,EST
7320,"LiveArea, a Merkle Company",200,600.0,IT Services and IT Consulting,"Brand Development, Digital Commerce Strategy, Digital Analytics & Optimization, Visual Design, User Experience Design, Copywriting, Interactive Development, Content Creation, Display & Social Media Marketing, SEO & Paid Search, Email Marketing, Affiliate Marketing, Systems Integration, Omni-Channel Strategy, Commerce Platform Implementation, Platform Evaluation & Selection, Conversion Optimization, Storefront Management, Project Rescue, Managed Services, Business User Training & Enablement, NXT Intelligence, Service Design, Product Innovation, Connected Commerce, Performance Marketing, Orchestrated Services",Public Company,United States,Dallas,EST
7330,Lone Star Transportation,300,800.0,Truck Transportation,"Flat Bed, Heavy Haul, Over Dimensional, Oversized Freight",Public Company,United States,Fort Worth,EST
7340,Louisiana-Pacific Corporation,3200,4300.0,Wholesale Building Materials,,Public Company,United States,Nashville,EST
7350,Lucky Core Industries,100,300.0,Chemical Manufacturing,,Public Company,Pakistan,Karachi,PKT
7360,Lupin Pharmaceuticals,2300,18000.0,Pharmaceutical Manufacturing,,Privately Held,United States,Baltimore,EST
7370,MAGRABi Retail Group,300,1500.0,Retail Luxury Goods and Jewelry,"Luxury, Eyewear, Fashion, Lifestyle, Sunglasses, Eyeglasses, Contact Lenses, Ophthalmic Lenses, Accessories, Design, Retail, Innovation, Eye Care, Optical, Customization, Specialty Gifts, Personalization, Styling, Experiential Marketing, Customer Service",Privately Held,United Arab Emirates,Dubai,GST
7380,"MEC (Mayville Engineering Company, Inc.)",200,1000.0,Industrial Machinery Manufacturing,,Public Company,United States,Mayville,EST
7390,MERS / Goodwill,80,1000.0,Non-profit Organizations,"Job Development, Job Coaching, Job Networking, Business Development, Retail, Social Work, Education",Nonprofit,United States,Saint Louis,EST
7400,"MHA - Springfield, MA",50,500.0,Non-profit Organizations,"Mental Health, Nonprofit, Developmental Disabilities , Intellectual Disabilities , Brain Injuries, Counseling, Addiction, Rehabilitation, Homelessness, Homeless, Disabilities, Acquired Brain Injuries, Addiction Recovery, Residential Support, Emotional Health, Health and Wellness, Healthcare",Nonprofit,United States,Springfield,EST
7410,MKS Instruments,2200,6200.0,Semiconductor Manufacturing,,Public Company,United States,Andover,EST
7420,MOD Pizza,400,7500.0,Restaurants,Specializing in individual artisan-style pizzas and salads,Privately Held,United States,Bellevue,EST
7430,MSA - The Safety Company,1400,4200.0,Public Safety,"Safety Product Manufacturing, Gas and Flame Detection, Head Protection, Fall Protection, Respiratory Protection, Eye/Face/Hearing Protection, Thermal Imaging Cameras, Safety Training, Personal Protective Equipment",Public Company,United States,Cranberry Township,EST
7440,MSC Industrial Supply Co.,3300,6500.0,Wholesale,"Distribution, Maintenance, Repair & Operations (MRO) Solutions, Metalworking Solutions & Expertise, ControlPoint Inventory Management Technology Solutions, Supply Chain Expertise & Services, Facility Management, Inventory Management Services, Manufacturing",Public Company,United States,Davidson,EST
7450,MSX International,1400,6000.0,Business Consulting and Services,"automotive industry, sales distribution, warranry management, customer engagement, technical publications, learning, technical information, data and insights, aftersales, repair optimisation, retail business tranformation, Consumer Experience, sales performance, EVs , new agency models",Privately Held,United States,Detroit,EST
7460,MTS Systems Corporation,700,3000.0,Industrial Machinery Manufacturing,"Engineering, Test Systems, Design, Manufacturing, Materials Testing",Public Company,United States,Eden Prairie,EST
7470,Macmillan Learning,179,911.0,Education Management,"learning, teaching, learning science, analytics, authorship, active learning, higher education, education, college, textbooks, digital learning, remote learning, STEM, Economics, Composition, History, Communications, Math, Chemistry, Physics, Science, edtech, Student Engagement, HigherEd",Privately Held,United States,New York City,EST
7480,Macnica Americas,100,300.0,Semiconductor Manufacturing,"FPGA, Design Services, PCIe, Video, USB 3.0, Altera, SiTime, Intel, Ambarella, Image Sensors, LCDs, Machine Vision, Deep Learning, Video Processing, Video Transport, Storage, Broadcast Video, SMPTE, ADI, Analog Devices, SLVS-EC, ST2110, LCD Display, Touchscreen, optical bonding, distribution, inventory management, SOC, SoM, video imaging, AI, Pro AV, Canon, Lantronix, Infineon, i-chips, Prophesee, innolux, Ortustech",Public Company,United States,Solana Beach,EST
7490,Madewell,1200,3000.0,Retail Apparel and Fashion,"retail, jeans, specialty apparel, denim",Privately Held,United States,New York,EST
7500,"MagRabbit, Inc.",30,100.0,IT Services and IT Consulting,"Legacy Technology Migration, ERP On-Going Maintenance, Custom Business Mobile/Web Apps, Salesforece Cloud Apps, IOT Turnkey Development, Cloud DevOPs, Supply Chain Managemnt, K1-K12 Digital Books Development, Product Procurements",Privately Held,United States,Cedar Park,EST
7510,Magic Leap,500,1000.0,Consumer Electronics,,Privately Held,United States,Plantation,EST
7520,Magrabi Hospitals & Centers,900,3200.0,Hospitals and Health Care,"Ophthalmology, ENT, Dentistry",Privately Held,Saudi Arabia,Jeddah & Mecca,AST
7530,Makino,1500,3400.0,Machinery Manufacturing,"Horizontal Machining Centers, Vertical Machining Centers, Wire EDMs, Sinker EDMs, 5-Axis Machining Centers, Engineering Services, Grinding, Die and Mold, Die & Mould, Tooling, Part Processing, Automation Processes, Tool Changers, Technical Solutions, Smart Machines, Spindles, Automated Cells & Systems, RAM EDM, Automation, Turnkey, Manufacturing Processes, Software, Digital Technologies, Manufacturing, Component Processing",Privately Held,United States,Mason,EST
7540,Manatron,80,200.0,Software Development,"Government land and property administration software development, CAMA (computer aided mass appraisal) software, property tax assessment, records management, tax collection software, land registry, Geographic Information Systems (GIS)",Privately Held,United States,Portage,EST
7550,Marathon Oil Corporation,5400,2300.0,Oil and Gas,"Exploration, Production",Public Company,United States,Houston,EST
7560,Marcura,100,400.0,Logistics & Supply Chain,"Maritime , Shipping , Seaborne Execution , Disbursement accounts , VOYAGE MANAGEMENT SERVICES, VOYAGE OPTIMISATION AND DECISION SUPPORT, Charter Party Management, Port call optimization, MARITIME PAYMENT SERVICES, Laytime Management, Port Cost Management , payments, maritime payments, chartering, marine, automation, digitisation, operations, maritime operations, finance, accounting, DA, FDA, PDA, laytime, agents, crew payments, compliance, marine sanctions, maritimetechnology, MarTech, Maritime compliance, Marine",Privately Held,United Arab Emirates,Dubai,GST
7570,Marlabs LLC,300,1500.0,IT Services and IT Consulting,"Cloud  Computing, SAP, Mobility, Oracle, Analytics, Application Development, Microsoft, Infrastructure Services, Java, Cyber Security, Testing Services, Product Engineering, Digital Asset Management, Consulting Services, Internet of Things, HANA, Salesforce, Agile Development, Artificial Intelligence, Big Data, Business Intelligence, Cloud Computing, Cognitive Science, Customer Experience, Data Analysis, Data Science, DevOps, Information Engineering, Information Technology, Infrastructure as a Service, IoT, Machine Learning, Network Security, Predictive Analytics, Technology Consulting, Digital360, Digital Transformation, Digital Product Engineering, Digital Automation, Enterprise Analytics, Digital Security, Digital User Experience, Application Prototyping, Software Co-Creation, Rapid Digitization, Intent-Intelligence, Blockchain, Machine Reasoning, Natural Language Generation, Natural Language Processing, Data Analysis, Digital Customer Experience",Privately Held,United States,Piscataway,EST
7580,Martek Biosciences,300,800.0,Biotechnology Research,"fermentation, DHA, omega-3",Public Company,United States,Columbia,EST
7590,Matthews International,1500,5800.0,Manufacturing,"Manufacturing, Marketing, Branding, Packaging, Marking, Funeral Services, Printing, Automation",Public Company,United States,Pittsburgh,EST
7600,Matthews Memorialization,30,100.0,Manufacturing,"Funeral Services, Cemetery Products, Architectural Signage, Statuary ",Public Company,United States,Pittsburgh,EST
7610,Maui Jim Sunglasses,303.2,954.0,Luxury Goods & Jewelry,"Luxury Sunglasses, Eyewear, Eyeglasses, Prescription Eyewear, PolarizedPlus2 Lens Technology",Public Company,United States,Peoria,EST
7620,Mavenir,1100,4100.0,Software Development,"Mobile Core, Radio Access Network, Packet Compute, Advanced Services, RCS, VoLTE, Business Messaging, 4G/5G Networks, OpenRAN, 5G Core, IMS Core, 5G",Privately Held,United States,Richardson,EST
7630,Max Fashion MENA & SEA,300,1500.0,Retail Apparel and Fashion,,Privately Held,United Arab Emirates,Dubai,GST
7640,McCormick & Company,6300,13000.0,Food Production,,Public Company,United States,Hunt Valley,EST
7650,McDonald's Qatar,200,2000.0,Restaurants,,Privately Held,Qatar,Doha,AST
7660,McKesson Corporation,270000,50000.0,Hospitals and Health Care,,Public Company,United States,Irving,EST
7670,McLarens,300,1200.0,Insurance,"Global Claims Services, Casualty loss adjusting, Property loss adjusting, Aviation loss adjusting, Technical loss adjusting, FAJ & Specie loss adjusting, Marine loss adjusting, Natural Resources loss adjusting, Agricultural loss adjusting, TPA Services, Forensic Engineering, Forensic Fire Investigation, Environmental Services, Construction Defect Analysis, Industrial Loss Services",Privately Held,United States,Peachtree Corners,EST
7680,"McNeilus Truck and Manufacturing, Inc.",400,1500.0,Motor Vehicle Manufacturing,"Electrification, Telematics, Autonomy, Electric Vechicles, Rear Loaders, Side Loaders, Front Loaders, Parts, Service, Refuse Collection Solutions",Public Company,United States,Dodge Center,EST
7690,Mediclinic Middle East,800,4200.0,Hospitals and Health Care,Healthcare & Hospitals,Public Company,United Arab Emirates,Dubai,GST
7700,Melal Credit Institution,150,200.0,Banking,,Public Company,Iran,Tehran,IRST
7710,Metagenics,300,600.0,Wellness and Fitness Services,"metagenics, health, wellness, functional medicine, firstline therapy, nutrigenomics, nutraceuticals, nutrition",Privately Held,United States,Aliso Viejo,EST
7720,Methodist Le Bonheur Healthcare,2000,13000.0,Hospitals and Health Care,"Cardiology, Neuroscience, Transplants, Maternity, Nursing, Cancer Care, Behavioral Health, Diabetes & Endocrinology, Hospice Care, Imaging & Diagnostic Services, Faith & Health, Orthopedics, Vascular & Endovascular Surgery, Womens Health, Primary Care",Nonprofit,United States,Memphis,EST
7730,MetricStream,300,1900.0,Software Development,"GRC, Corporate Governance, Enterprise Risk Management, Internal Audits, Quality Management, Supply Chain Governance, Third-party Management, Vendor/3rd party Risk Management, Compliance Management, IT GRC, SOX Compliance, Policy and Document Management, Case/Incident Management, Risk Management, Audit Management, GDPR, Survey Management",Privately Held,United States,San Jose,EST
7740,Microtel Inn & Suites by Wyndham,500,2000.0,Hospitality,,Public Company,United States,Parisppany,EST
7750,Microvast,150,400.0,Manufacturing,"LpCO / LpTO Lithium Ion Batteries;LpCO pouch cell, Automotive PHEV, HEV, BEV; Stationary Power; Battery Backup; Industrial Equipment;  Custom Solutions; Battery MFG / Development, EV, ESS, Energy Storage, Battery, BEV, MpCO, HpCO, NMC, Battery solution, BMS, Cell, Module, Pack",Public Company,United States,Stafford,EST
7760,Midis Group,500,3000.0,IT Services and IT Consulting,"Computer Systems, Networking & Communications, Site & Power Solutions, Software & Professional Services, Electronic Components & Peripherals, Data and AI, Security, Cloud",Privately Held,Lebanon,Beirut,EET
7770,Millennium Hotel Hail,40,250.0,Hospitality,,Partnership,Saudi Arabia,Ha'Il,AST
7780,MillerCoors,7500,6100.0,Food and Beverage Services,"Beer, Adult Beverage, Consumer Goods",Public Company,United States,Chicago,EST
7790,Milliken & Company,3000,7200.0,Industrial Machinery Manufacturing,"Specialty Chemicals, Performance Solutions by Milliken, Floor Covering, Manufacturing, Textiles, Healthcare",Privately Held,United States,Spartanburg,EST
7800,Milliken Textiles,1000,2500.0,Textile Manufacturing,"Apparel, Automotive + Transportation, Military, Protective, Cable Management, Interiors, Hospitality, Building & Infrastructure, Industrial",Privately Held,United States,Spartanburg,EST
