10150,Saudi Railway Company,350,2000.0,Transportation/Trucking/Railroad,"Railway Infrastructures, Operations and Maintenance, Passengers Line, Freight Line, Mineral Line",Privately Held,Saudi Arabia,Riyadh,AST
10160,Saudi Readymix Concrete Co,800,4000.0,Construction,,Privately Held,Saudi Arabia,Ad Dammam,AST
10170,Saudia Cargo,1200,1000.0,Airlines and Aviation,"Serve the Airfreight industry with a spirit of excellence by continuously enhancing service levels, develop effective logistics solutions to the highest industry standards",Privately Held,Saudi Arabia,Jeddah,AST
10180,Savola Foods Company,9000,1450.0,Food and Beverage Manufacturing,,Privately Held,Saudi Arabia,Jeddah,AST
10190,Savola Group,4200,14000.0,Financial Services,"Food, Retail",Public Company,Saudi Arabia,Jeddah,AST
10200,Sawaeed Employment LLC,100,600.0,Human Resources Services,"Recruitment, labour Supply, oil and Gas, Emiratisation, Domestic and hospitality staffs, Employment Services, Facility Management, White Collar Outsourcing, Blue Collar Outsourcing, Manpower Outsourcing",Partnership,United Arab Emirates,Abu Dhabi,GST
10210,Schindler Elevator Corporation (U.S.),2100,5300.0,Industrial Machinery Manufacturing,"Elevators, Escalators, Moving Walks, Mobility Services, Transit Management, Urban Mobility, Innovation",Public Company,United States,Morristown,EST
10220,Schindler Elevator Corporation Canada,1000,3000.0,Construction,"Elevators, Escalators, Moving walks",Privately Held,Canada,Toronto,EST
10230,Schluter Systems,1000,5000.0,Wholesale Building Materials,"Trim Profiles, Uncoupling and Waterproofing Membranes, Tile Backerboard, Shower Kits, Modular Screed Systems, Linear Drains, Electric Floor Warming System, shower systems, Tile floor systems, Waterproofing, Shower niche, Movement Joints, Setting Materials, Education for Tile Industry",Privately Held,United States,Plattsburgh,EST
10240,Scientific Drilling,300,2000.0,Oil and Gas,"Directional Drilling, Rotary Steerable Services, MWD / LWD Solutions, Well Planning, Magnetic Ranging, Survey Management, Drilling Motor Services, Drilling Engineering, Wellbore Surveying, Cased Hole Services",Privately Held,United States,The Woodlands,EST
10250,Seaboard Triumph Foods,500,2000.0,Food and Beverage Manufacturing,"Pork Production, Quality Assurance, Pork Processing, Food Safety",Partnership,United States,Sioux City,EST
10260,Securitas nv,5000,370000.0,Security and Investigations,,Privately Held,Belguim,Neder-Over-Heembeek,CET
10270,Seed Consulting Group,10,50.0,Non-profit Organizations,"Pro Bono, Environmental, Non-Profit, Quantitative Analysis, Management Consulting, Data Analytics, New Program Development, Marketing & Advertising Strategy, Volunteer Engagement, Organizational Development, Fundraising, Environmental Impact",Nonprofit,United States,Los Angeles,EST
10280,"SelectBuild Nevada, Inc.",200,1000.0,Construction,"Construction, Lumber, Building Materials, Millwork",Privately Held,United States,Las Vegas,PST
10290,Seneca Foods Corporation,1200,3300.0,Food and Beverage Manufacturing,Food Processing,Public Company,United States,Fairport,EST
10300,"Serta Simmons Bedding, LLC",3000,6000.0,Consumer Goods,"Household Furnishings, Manufacturing",Privately Held,United States,Doraville,EST
10310,Shane Co.,300,1200.0,Retail,"Diamonds, Rubies, Sapphires, Pearls, Jewelry, Retail",Privately Held,United States,Greenwood Village,EST
10320,"Shangri-La Qaryat Al Beri, Abu Dhabi",100,1000.0,Hospitality,"Hospitality, Hotel, Food & Beverage, Events, Banquets, Conference, Spa, Family, Wellness, Residences, Villas",Public Company,United Arab Emirates,Abu Dhabi,GST
10330,Sharjah Coop,300,1500.0,Retail,Retail,Public Company,United Arab Emirates,Sharjah,GST
10340,Sheetz,7500,17000.0,Retail,"Fresh Food Made to Order, Sheetz Bros Coffee, Shweetz, MTO-Go, Sheetz Fam, Sheetz Jobs",Privately Held,United States,Altoona,EST
10350,Shields,80,300.0,Plastics Manufacturing,"Stretch Hooder Film, Security (Bank) Bags, Courier Bags, Barrier Films, Square Bottom Wicketed Bags, Printed Collation Shrink Films, Heavy Duty Bags and Rollstock",Privately Held,United States,Yakima,EST
10360,Shure Incorporated,800,3200.0,Consumer Electronics,"Microphones & Networked Microphones, Wireless Microphone Systems, Personal Monitor Systems, Headphones and Earphones, Digital Signal Processors, Presentation, Conference and Discussion Systems, Conference Room Audio, Automatic Mixers , Bluetooth Earphones, Mobile Microphones, Array Microphones, Audio Conferencing & Collaboration, Conferencing and Discussion Products, Dante and Network Connectivity, Microphone Array Technology, Product Training (Shure Audio Institute), Unified Communication Collaboration",Privately Held,United States,Niles,EST
10370,Sigma Cylinders,200,400.0,Automation Machinery Manufacturing,"Manufacturing of gas cylinders (LPG), LPG cylinder manufacturing and refurbishment, Awareness campaigns , Regulations and norms, Distribution networks, Procurement of LPG vehicle , Regulating LPG cylinders and accessories, Network plan, Supervision and support",Privately Held,Lebanon,Beirut,EET
10380,Sigura Water,200,300.0,Renewable Energy Semiconductor Manufacturing,,Privately Held,United States,Alpharetta,EST
10390,Sika USA,1500,4000.0,Chemical Manufacturing,"Adhesives & Sealants, Concrete, Faade & Walls, Flooring, Repair & Protection, Roofing, Waterproofing & Coatings, Residential Repairs, Expansion Joints, Sustainability, Marine, Automotive, Transportation, Innovation",Public Company,United States,Lyndhurst,EST
10400,Simpson Strong-Tie,900,3200.0,Building Materials,"Engineered Structural Connectors, Fasteners and Fastening Systems, Mechanical and Adhesive Anchors, Lateral-Force Resistance Systems, Repair, Protection and Strengthening Products",Public Company,United States,Pleasanton,EST
10410,SiteOne Landscape Supply,3700,4500.0,Wholesale,"Irrigation, Outdoor Lighting, Nursery, Turf Protection and maintenance, Hardscapes, Landscape Supplies, Pest Control, Tools, Drainage, Agronomics",Public Company,United States,Roswell,EST
10420,Sitel Digital Services (formerly SYKES),3200,55000.0,IT Services and IT Consulting,,Privately Held,United States,Tampa,EST
10430,Skyhigh Security,100,500.0,Computer Software,,Privately Held,United States,San Jose,EST
10440,"Skyworks Solutions, Inc.",4700,9000.0,Semiconductors,"Wireless Connectivity, Internet of Things, RF Engineering, Design Engineers, RF/Analog Semiconductors, High Performance Solutions, Technology Innovation, 5G, LTE",Public Company,United States,Irvine,EST
10450,Sleep Number Corporation,1700,4100.0,Retail,"Beds, Mattresses, Adjustable Beds, Bedding, Pillows, Sleep Technology, health and wellness",Public Company,United States,Minneapolis,EST
10460,"Slintel, a 6sense company",50,150.0,Software Development,"Sales Intelligence, abm, marketing, sales, revops, Intent Data",Privately Held,United States,Mountain View,EST
10470,Sloan,250,1000.0,Wholesale Building Materials,"flush valves, sensor faucets, sensor soap dispensers, commercial fixtures, commercial toilets, urinals, waterfree urinals, shower heads, sink systems, sinks, water savings, water efficiency, manual flush valves, electronic flush valves, water closets, vitreous china",Privately Held,United States,Franklin Park,EST
10480,Snohomish County PUD,1800,1500.0,Utilities,"Electric and Water Utility, Community Resource",Nonprofit,United States,Everett,EST
10490,Sofidel America Corp.,3000,4000.0,Paper and Forest Product Manufacturing,,Privately Held,United States,Horsham,EST
10500,Solaria Corporation,100,300.0,Renewable Energy Semiconductor Manufacturing,"Manufacturing, Solar Panels, Clean Energy, residential solar, commercial solar, rooftop solar, Attractive solar panels, high efficiency solar panels, proven performance, American innovation  ingenuity, aesthetic solar, curb appeal, renewable generation, highly rated, beautiful solar, solar for homes",Privately Held,United States,Fremont,EST
10510,Solenis,1200,3700.0,Chemical Manufacturing,,Privately Held,United States,Wilmington,EST
10520,Solid Concepts Inc.,50,150.0,Industrial Machinery Manufacturing,"Rapid Prototyping, Custom Manufacturing, Additive Manufacturing, SolidView, PolyJet, SLA, Stereolithography, SLS, Selective Laser Sintering, CNC, QuantumCast Cast Urethanes, FRP, Tooling, Injection Molding, 3D Printing",Public Company,United States,Valencia,EST
10530,Solidigm,1100,2200.0,Computer Hardware Manufacturing,,Privately Held,United States,Rancho Cordova,EST
10540,Sonata Software North America Inc.,250,800.0,IT Services and IT Consulting,,Public Company,United States,Fremont,EST
10550,Sonny's Enterprises Inc.,300,1200.0,Motor Vehicle Manufacturing,"Car Wash, Car Wash equipment, Car wash supplies, Car wash Manufacturer, car wash business",Privately Held,United States,Tamarac,EST
10560,Sony Electronics,7800,11000.0,Consumer Electronics,"Consumer Electronics, Consumer Software, Business & IT Solutions, Sales & Marketing",Public Company,United States,New York,EST
10570,Sophos Solutions,1000,3000.0,IT Services and IT Consulting,"Core Banking, Banking Transformation, Cloud Services, Data Intelligence & AI, Expert IT Talent",Privately Held,United States,Iselin,EST
10580,"Southco, Inc.",500,2100.0,Industrial Machinery Manufacturing,,Privately Held,United States,Concordville,EST
10590,Southern Oregon University,200,800.0,Higher Education,,Educational Institution,United States,Ashland,EST
10600,Southwire Company,9000,7000.0,Electrical & Electronic Manufacturing,"Industrial, Electrical, Energy, OEM, Southwire Continuous Rod, Tools and Assembled Products, Carrollton, GA",Privately Held,United States,Carrollton,EST
10610,Spansion is Cypress Semiconductor,1400,3400.0,Semiconductor Manufacturing,"Charge trapping technology, NOR Flash Memory, NAND Flash Memory, Serial Flash Memory, ARM Microcontrollers, Analog Products, Power Management ICs, Energy Harvesting ICs",Public Company,United States,Sunnyvale,EST
10620,"Spark Therapeutics, Inc.",200,900.0,Biotechnology Research,"Biotechnology, Gene therapy",Privately Held,United States,Philadelphia,EST
10630,Specialized Bicycle Components,800,1200.0,Retail,"Bicycles, Design, Engineering, Product Development, Marketing, Human Resources, Sales, Finance, Outdoor Industry, Cycling, Distribution, eCommerce",Privately Held,United States,Morgan Hill,EST
10640,Spire,900,1800.0,Utilities,,Public Company,United States,St. Louis,CST
10650,Sportsman's Warehouse,3400,8000.0,Retail,"Retail, Outdoor, Sporting, Goods, Hunting, Firearms, Reloading, Fishing, Camping, Optics, Outerwear, Footwear",Public Company,United States,West Jordan,EST
10660,St. John's Riverside Hospital,700,2700.0,Hospitals and Health Care,,Nonprofit,United States,Yonkers,EST
10670,StandardAero,1500,6000.0,Aviation and Aerospace Component Manufacturing,,Privately Held,United States,Scottsdale,EST
10680,Starkey Hearing,800,3200.0,Medical Equipment Manufacturing,"audiology, hearing aids, hearing systems, hearing healthcare, education, training, manufacturing, engineering",Privately Held,United States,Eden Prairie,EST
10690,Stater Bros. Markets,4100,18000.0,Retail,"Organic supermarket, Community outreach, Fresh produce, Organic produce, Quality meats, Vegan options, Gluten Free options",Privately Held,United States,San Bernardino,EST
10700,Stepan Company,2000,2200.0,Chemicals,"Surfactants, Polymers, Specialty Products, Chemicals, lipid nutrition, Nonionic Surfactants",Public Company,United States,Northbrook,EST
10710,Stericycle,2060,13500.0,Hospital & Health Care,"Sharps and Medical Waste Disposal Service, Communication Solutions, OSHA Compliance Programs, Pharmaceutical Waste Services, Sharps Containers and Healthcare Products, Document Destruction, Patient Engagement Solutions",Public Company,United States,Bannockburn,EST
10720,Stock Building Supply is now BMC!,3500,9000.0,Wholesale Building Materials,Building Materials and Solutions,Public Company,United States,Atlanta,EST
10730,Stoller Newport News Nuclear,300,1000.0,Environmental Services,"Environmental, Nuclear, Waste Consulting",Public Company,United States,Broomfield,MST
10740,Subaru of Indiana Automotive,4200,5700.0,Motor Vehicle Manufacturing,"Automotive, Manufacturing",Privately Held,United States,Lafayette,EST
10750,Sumitomo Corporation of Americas,10000,20000.0,International Trade and Development,"Oil & Gas, Infrastructure, Lifestyle & Consumer Products, Natural Resources & Agricultural Products",Privately Held,United States,New York,EST
10760,Summit,100,500.0,Food and Beverage Services,"Corrections, Correctional Facilities, Food Service, Commissary",Privately Held,United States,Sioux Falls,EST
10770,Sun Chemical,7800,8000.0,Chemical Manufacturing,"Printing Inks, Coatings, Pressroom Supplies, Pigments, Advanced Materials, Color Management, Packaging Solutions, Polymers, Liquid Compounds, Solid Compounds, Application Materials",Privately Held,United States,Parsippany,EST
10780,Sun Communities & Sun Outdoors,2000,5000.0,Real Estate,,Public Company,United States,Southfield,EST
10790,SunPower Corporation,1800,2200.0,Renewables & Environment,"solar, residential solar systems, project development, photovoltaic, alternative energy, renewable energy, energy service provider, monitoring, solar storage",Public Company,United States,Richmond,EST
10800,Sunbulah Group,700,2000.0,Manufacturing,,Privately Held,Saudi Arabia,Jeddah,AST
10810,Super 8 by Wyndham,500,1200.0,Hospitality,,Public Company,United States,Parsippany,EST
10820,Superior Industries,1300,3000.0,Motor Vehicle Manufacturing,"Aluminum Cast and Flow Formed Wheels, Premium Finishes, Light Weight Technologies, Forged wheels",Public Company,United States,Southfield,EST
10830,Supermicro,7123,5120.0,Computer Hardware,"Servers, Storage, IOT, Datacenter, Enterprise Solutions, Computer Hardware, GPU Systems, Rack Solutions, Embedded, Motherboards, Enclosures, Networking, Switch, Management Software, Software Defined, Machine Learning, Power Supply, AI, Edge, Liquid Cooling",Public Company,United States,San Jose,EST
10840,Swagelok,3200,5600.0,Industrial Machinery Manufacturing,"valves, regulators, hoses, oil and gas, chemical processing, biopharmaceutical, research, tube fittings, fluid systems, semiconductor manufacturing, transportation",Privately Held,United States,Solon,EST
10850,Swift Transportation,4100,22000.0,Truck Transportation,"Full Truckload, Linehaul, Intermodal, Dedicated, Temperature Controlled, Flatbed, Logistics Brokerage and Full Managed Trans., Expedited / Teams, Cross Border Mexico and Canada, Swift Express, Trade Show, Owner Operators, Heavy Haul, Refrigerated",Public Company,United States,Phoenix,EST
10860,Symphony Teleca,1000,6000.0,IT Services and IT Consulting,"Infotainment, Consumer Electronics, Cloud Services, Professional and Automotive Sound, Loudspeaker, Home Entertainment, Healthcare, Software Solutions, Lighting, Connected products and solutions",Privately Held,United States,Mountain View,EST
10870,Synaptics Incorporated,1300,2100.0,Semiconductor Manufacturing,"Capacitive Sensing, AI & Neural Network, Far-field Voice & Speech Capture, Acoustics & Audio Processing, Optical Imaging, Video & Imaging Processing, Display Driver & Integrated Sensing, Video Interface, Wireless Connectivity",Public Company,California,San Jose,PST
10880,Syniti,300,800.0,Software Development,"Data, Data Journey, Data Transformation, S/4HANA, SAP S/4HANA",Privately Held,United States,Needham,EST
10890,Systems Plus Solutions,100,250.0,IT Services and IT Consulting,"Sourcing Advisory, Governance Risk and Compliance, Microsoft Technologies(C #, VB.NET, ASP.NET, WPF, Silverlight, VB, Business Object ), Manage Captive Services, Open Source Technologies, Portal, Mobility, Java, Robotic Process Automation, Retail Solutions, Managed GIC, Cloud solutions, DevOps, IT Consulting Services, Distributed Agile",Privately Held,United States,Dallas,EST
10900,TAC Air,150,400.0,Aviation and Aerospace Component Manufacturing,"FBO/Fixed Base Operations, Aircraft Hangar, Aircraft Maintenance, Government Contract Fuel, Aviation Fuel, Aviation Maintenance, Customer Service, FBO, Ground Handling Services, Aircraft Fueling, FBOs, Hangar Space, Aircraft Maintenance, Quick Turns, Jet Fuel, Ground Handling, Pilots' Lounge, NATA Safety 1st Clean, IS-BAH Stage II Registered, NATA Safety 1st, Sanitized, Clean Facility, COVID-19 Safety Protocols, Cargo Handling",Privately Held,United States,Dallas,CST
10910,TAHAKOM,200,600.0,Information Technology & Services,,Public Company,Saudi Arabia,Riyadh,AST
10920,TAQA (Industrialization & Energy Services Company),1500,3200.0,Oil and Gas,"Oil and gas exploration and drilling, conducting geophysical surveys and establishing a wide range of industries and services in support of oil and gas, metals, petrochemicals, mining, electricity and water sectors, Cementing , Enabler of Energy, Employer of Choice, well services, technology",Privately Held,Saudi Arabia,Dhahran,AST
10930,TASNEE,3400,4100.0,Chemicals,"Petrochemicals, Chemicals, Metals, Services",Public Company,Saudi Arabia,Riyadh,AST
10940,TBC Corporation,3500,10400.0,Motor Vehicle Manufacturing,"Tires, Automotive Service, Tire Service & Repair, Oil, Lube & Filters, Routine Services & Fluids, Batteries, Brakes, Alignment, Suspension & Front End",Privately Held,United States,Palm Beach Gardens,EST
10950,TECO Energy,4400,4300.0,Utilities,Energy,Public Company,United States,Tampa,EST
10960,TESSCO Technologies,500,1000.0,Telecommunications,"Network Systems, Base Station Infrastructure, Installation Test & Maintenance, Training & Services",Public Company,United States,Hunt Valley,EST
10970,"TETRA Technologies, Inc.",700,1500.0,Oil and Gas,"Early Production Facilities, Water Management Solutions (Frac), Completion Fluids & Svcs, Well Testing & Flow Back, Calcium Chloride, Brominated products, Rig Cooling, Sand Management, Low Carbon Solutions",Public Company,United States,The Woodlands,EST
10990,TIC - The Industrial Company,3000,9000.0,Construction,"Power (including Renewable Energy), Mining/Minerals Processing, Oil, Gas & Chemical, Food and Beverage processing, Pulp & Paper",Privately Held,United States,Englewood,EST
11000,TRIUMPH,1200,2200.0,Aviation and Aerospace Component Manufacturing,,Public Company,United States,Berwyn,EST
11010,TRYP by Wyndham,500,2000.0,Hospitality,,Public Company,United States,Parsippany,EST
11020,TSI Incorporated,500,1400.0,Industrial Machinery Manufacturing,"scientific instruments, aerosol and particle technology, healthcare, measurement, respirator fit testing, occupational health and safety, industrial hygiene, manufacturing, indoor air quality, particle counters, fluid mechanics, HVAC testing, ventilation, filter testing, engine emissions, air quality",Privately Held,United States,Shoreview,EST
11030,TTX Company,1000,1200.0,Truck Transportation,"Provider of railcars and related freight car management services, Automobile Frame Transportation, Railcar Repair and Maintenance, Carbody Modification Programs, Railcar Fleet Management",Privately Held,United States,Charlotte,EST
11040,TUMI,750,1200.0,Retail,,Public Company,United States,Edison,EST
11050,TVH Parts Co.,1200,5700.0,Wholesale,"Forklifts and Construction Vehicles, Aerial Work Platforms, Sweeper & Scrubber, Personnel Burden Carrier, Material Handling, Industrial Equipment, Light Construction",Privately Held,United States,Olathe,EST
11060,Tabreed,1000,2000.0,Utilities,"District Cooling Services Provider, cooling, district cooling",Public Company,United States,Masdar City,GST
11070,Tapestry,5900,15000.0,Apparel & Fashion,,Public Company,United States,New York,EST
11080,Tavant,300,2500.0,Information Technology & Services,"Consumer Lending, eCommerce, Manufacturing, Outsourced Product Development, Aftermarket Service Operations, OTT - Over The Top, DevOps, Analytics and Big Data, Artificial Intelligence, Warranty, Proptech, banktech, Media and Entertainment",Privately Held,United States,Santa Clara,EST
11090,"Taylor Smith Consulting, LLC",20,100.0,Staffing and Recruiting,"Staffing & Recruiting, Training, Management Consulting",Privately Held,United States,Houston,EST
11100,Techwave,200,2200.0,IT Services and IT Consulting,"Business Analytics, Enterprise Performance Management (EPM), Enterprise Resource Planning (ERP), Managed Services (AMS - Onshore, Near Shore, Offshore), Quality Assurance & Testing, Big Data, Business Process Management (BPM), Internet of Things, Cloud, ISO20022 Payments Data Management, Application Modernization, API Ecosystem Management, Wireline Engineering, Wireless Engineering",Privately Held,United States,Houston,EST
11110,Teleflex,2100,12000.0,Medical Equipment Manufacturing,,Public Company,United States,Wayne,EST
11120,Tennant Company,1000,4300.0,Machinery Manufacturing,"Sustainability, Cleaning Solutions, Floor Cleaning Equipment",Public Company,United States,Eden Prairie,EST
11130,Tennessean,50,200.0,Newspaper Publishing,"Digital Media, Journalism, Community Service, Impact Journalism, Publishing, Marketing, Advertising, News, Politics, Sports, Music, Country Music, Business, Religion, Education, Community News, Video",Public Company,United States,Nashville,EST
11140,Teradyne,3100,5400.0,Industrial Automation,"Electronics Manufacturing, Robotics, Semiconductor Test, Industrial Automation, Production Board Test, System Level Test, Storage Test, Wireless Test, Memory Test",Public Company,United States,North Reading,EST
11150,Terex Corporation,4100,10600.0,Machinery Manufacturing,"Terex builds the equipment that helps build the world's infrastructure., Terex mobile cranes, Powerscreen crushing and screening equipment, EvoQuip compact crushing and screening equipment, Fuchs material handlers, Terex Finlay crushing and screening equipment, CBI horizontal grinders and industrial wood chippers, Terex utility aerial devices, digger derricks and auger tools, Terex Financial Services, Genie telehandlers, Terex Ecotec wood processing, biomass and recycling equipment, Terex Bid-Well concrete roller pavers, Terex front discharge mixer trucks, Terex MPS crushing and screening equipment, Genie booms, lifts and work platforms",Public Company,United States,Norwalk,EST
11160,Terumo Blood and Cell Technologies,2200,3200.0,Medical Device,"blood component separation and processing, therapeutic apheresis, cellular technologies, regenerative medicine",Public Company,United States,Lakewood,EST
11170,Terumo Medical Corporation,2300,5500.0,Medical Device,"Terumo Interventional Systems markets medical devices for endovascular procedures: peripheral embolization, transradial solutions, introducer sheaths, guiding sheaths, guidewires, angiographic catheters, coronary catheters, microcatheters, embolics",Public Company,United States,Somerset,EST
11180,Testo Middle East,150,500.0,"Appliances, Electrical, and Electronics Manufacturing","Food Safety, Heating, Air-Condition, Ventilation, Refrigeration, Pharma&Health, Thermal imager, Flue Gas Analyzer, Smoke tester, Digital quality management system, Manifold, Oil tester, Thermometer, Data Logger, Pressure Monitoring, HVAC/R, Smart probe",Privately Held,United Arab Emirates,Nadd Al Hamar,GST
11190,Textron,14000,35000.0,Aviation and Aerospace Component Manufacturing,"Conglomerate, Aviation & Aerospace, Industrial, Defense",Public Company,United States,Providence,EST
11200,The AES Corporation,10700,10500.0,Utilities,"Energy, Clean Energy, Renewable Energy, Solar Energy, Wind Energy, Green Hydrogen",Public Company,United States,Arlington,EST
11210,The Aerospace Corporation,3800,3400.0,Defense and Space Manufacturing,"Aerospace, Defense, Space Policy , Technology, Computer Science, Software Engineering, Remote Sensing, Small Satellites, Launch Vehicles, Autonomous Systems, Artificial Intelligence, Machine Learning, Optical Communications, Laser Communications, Launch Certification, Government Relations, Propulsion Science, Space Research, Additive Manufacturing, Electric Propulsion, Engineering",Nonprofit,United States,El Segundo,EST
11220,The Arizona Republic,150,500.0,Newspaper Publishing,"publishing, marketing, advertising, local arizona news, media, news",Public Company,United States,Phoenix,EST
11230,The Associated Press,500,3000.0,Media Production,"Content solutions and news services, Archive content, Content production and distribution, Broadcast facilities, Newsroom production software, Media tools, Partnership opportunities",Nonprofit,United States,New York,EST
11240,The Center for Family Support Inc.,50,200.0,Non-profit Organizations,,Nonprofit,United States,New York,EST
11250,The Chemours Company,6100,7000.0,Chemical Manufacturing,"Titanium Technologies, Advanced Performance Materials, Thermal & Specialized Solutions, Chemical Solutions",Public Company,United States,Wilmington,EST
11260,The College of St. Scholastica,200,1500.0,Higher Education,"Undergraduate and graduate degree programs in Health Sciences, Management/MBA, Education, Health Information Management",Educational Institution,United States,Duluth,EST
11270,The Davey Tree Expert Company,1300,9500.0,Environmental Services,"tree services, grounds maintenance, environmental consulting services",Privately Held,United States,Kent,EST
11280,The Decurion Corporation,100,400.0,Entertainment Providers,,Privately Held,United States,Los Angeles,EST
11290,The Doctors Company,1200,850.0,Insurance,"Medical malpractice insurance for physicians, surgeons, large groups, hospitals, and integrated  delivery systems, medical practice coverages, patient safety and risk management, CME, claims management",Privately Held,United States,Napa,EST
11300,The Hershey Company,8500,16000.0,Manufacturing,Consumer Packaged Goods,Public Company,United States,Hershey,EST
11320,The Hillman Group,1200,2900.0,Manufacturing,,Public Company,United States,Cincinnati,EST
11330,The Johns Hopkins University School of Medicine,4000,25000.0,Hospitals and Health Care,,Educational,United States,Baltimore,EST
